{
  "$schema": "https://othmaneblial.github.io/rustframe/schemas/templates/v1/template.schema.json",
  "schemaVersion": 1,
  "id": "prism-gallery",
  "title": "Prism Gallery",
  "kind": "template",
  "provenance": "first-party",
  "workflow": "media-review",
  "summary": "Review visual assets, compare collection state, record ratings, and keep creative approvals in a local media queue.",
  "bestFor": ["media review", "creative approvals", "asset libraries"],
  "capabilities": ["database", "window"],
  "source": {
    "repository": "https://github.com/OthmaneBlial/rustframe",
    "path": "apps/prism-gallery"
  },
  "author": {
    "name": "Othmane Blial",
    "url": "https://github.com/OthmaneBlial"
  },
  "license": { "spdx": "MIT", "file": "LICENSE" },
  "platforms": ["macos", "windows", "linux"],
  "rustframe": { "minimumVersion": "0.1.0-rc.1", "testedVersion": "0.1.0-rc.3" },
  "verification": {
    "state": "verified",
    "profile": "rustframe-static-v1",
    "lastVerifiedAt": "2026-08-28"
  },
  "screenshot": {
    "path": "site/assets/screenshots/prism-gallery.webp",
    "width": 1460,
    "height": 940,
    "alt": "Prism Gallery media review queue with colorful asset cards, palette filters, ratings, and approval state"
  }
}
