{
  "$schema": "https://othmaneblial.github.io/rustframe/schemas/templates/v1/template.schema.json",
  "schemaVersion": 1,
  "id": "daybreak-notes",
  "title": "Daybreak Notes",
  "kind": "template",
  "provenance": "first-party",
  "workflow": "document-desk",
  "summary": "Capture working notes, pin the material that matters, and move documents through a calm offline editorial desk.",
  "bestFor": ["document workbenches", "field notes", "editorial research"],
  "capabilities": ["database", "window"],
  "source": {
    "repository": "https://github.com/OthmaneBlial/rustframe",
    "path": "apps/daybreak-notes"
  },
  "author": {
    "name": "Othmane Blial",
    "url": "https://github.com/OthmaneBlial"
  },
  "license": { "spdx": "MIT", "file": "LICENSE" },
  "platforms": ["macos", "windows", "linux"],
  "rustframe": { "minimumVersion": "0.1.0-rc.1", "testedVersion": "0.1.0-rc.3" },
  "verification": {
    "state": "verified",
    "profile": "rustframe-static-v1",
    "lastVerifiedAt": "2026-08-28"
  },
  "screenshot": {
    "path": "site/assets/screenshots/daybreak-notes.webp",
    "width": 1360,
    "height": 900,
    "alt": "Daybreak Notes document desk with note composer, mood filters, pinned notes, and local storage status"
  }
}
