{
  "$schema": "https://othmaneblial.github.io/rustframe/schemas/templates/v1/template.schema.json",
  "schemaVersion": 1,
  "id": "meridian-inventory",
  "title": "Meridian Inventory",
  "kind": "template",
  "provenance": "first-party",
  "workflow": "offline-inventory",
  "summary": "Track stock, locations, suppliers, and reorder pressure from an offline warehouse desk backed by local SQLite.",
  "bestFor": ["offline inventory", "warehouse desks", "equipment catalogs"],
  "capabilities": ["database", "window"],
  "source": {
    "repository": "https://github.com/OthmaneBlial/rustframe",
    "path": "apps/meridian-inventory"
  },
  "author": {
    "name": "Othmane Blial",
    "url": "https://github.com/OthmaneBlial"
  },
  "license": { "spdx": "MIT", "file": "LICENSE" },
  "platforms": ["macos", "windows", "linux"],
  "rustframe": { "minimumVersion": "0.1.0-rc.1", "testedVersion": "0.1.0-rc.4" },
  "verification": {
    "state": "verified",
    "profile": "rustframe-static-v1",
    "lastVerifiedAt": "2026-08-28"
  },
  "screenshot": {
    "path": "site/assets/screenshots/meridian-inventory.webp",
    "width": 1440,
    "height": 920,
    "alt": "Meridian Inventory offline warehouse desk with stock pressure, reorder filters, SKU locations, and suppliers"
  }
}
