{
  "$schema": "https://othmaneblial.github.io/rustframe/schemas/templates/v1/template.schema.json",
  "schemaVersion": 1,
  "id": "quill-studio",
  "title": "Quill Studio",
  "kind": "reference",
  "provenance": "first-party",
  "workflow": "editorial-planning",
  "summary": "Plan assignments, deadlines, channels, and story movement in an editorial workflow that keeps every decision local.",
  "bestFor": ["editorial planning", "content pipelines", "assignment desks"],
  "capabilities": ["database", "window"],
  "source": {
    "repository": "https://github.com/OthmaneBlial/rustframe",
    "path": "apps/quill-studio"
  },
  "author": {
    "name": "Othmane Blial",
    "url": "https://github.com/OthmaneBlial"
  },
  "license": { "spdx": "MIT", "file": "LICENSE" },
  "platforms": ["macos", "windows", "linux"],
  "rustframe": { "minimumVersion": "0.1.0-rc.1", "testedVersion": "0.1.0-rc.4" },
  "verification": {
    "state": "verified",
    "profile": "rustframe-static-v1",
    "lastVerifiedAt": "2026-08-28"
  },
  "screenshot": {
    "path": "site/assets/screenshots/quill-studio.webp",
    "width": 1460,
    "height": 940,
    "alt": "Quill Studio editorial planning desk with assignments, channels, deadlines, filters, and story status lanes"
  }
}
